{
    "schemaVersion": "v3",
    "description": "One common if constraint: before",
    "fields": [
        { "name": "A" },
        { "name": "B" },
        { "name": "C" },
        { "name": "D" },
        { "name": "E" }
    ],
    "rules" : [
		{ 
			"constraints": [
				{ "field": "A", "is": "inSet", "values": [ "a1", "a2" ] },
				{ "field": "B", "is": "inSet", "values": [ "b1", "b2" ] },
				{ "field": "C", "is": "inSet", "values": [ "c1", "c2" ] },
				{ "field": "D", "is": "inSet", "values": [ "d1", "d2" ] },
				{ "field": "E", "is": "inSet", "values": [ "e1", "e2" ] },
				{
					"if": {
						"allOf": [
							{ "field": "A", "is": "equalTo", "value": "a1" }
						] },
					"then": { 
						"allOf": [ {
								"if": {
									"allOf": [
										{ "field": "B", "is": "equalTo", "value": "b1" }
									]
								},
								"then": { "field": "D", "is": "equalTo", "value": "d1" }
							}, {
								"if": {
									"allOf": [
										{ "field": "C", "is": "equalTo", "value": "c1" }
									]
								},
								"then": { "field": "E", "is": "equalTo", "value": "e1" }
							}
						]
					}
				}
			]
		}
    ]
}